{
  "tool": "DriftGuard",
  "version": "0.2.0",
  "schemaVersion": 1,
  "policyApplied": false,
  "baseline": "[omitted]",
  "current": "[omitted]",
  "changes": [
    {
      "path": "$.features.analyticsEnabled",
      "operation": "added"
    }
  ],
  "findings": [],
  "summary": {
    "changeCount": 1,
    "findingCount": 0,
    "added": 1,
    "removed": 0,
    "changed": 0,
    "typeChanged": 0
  },
  "failOn": "none",
  "passed": true,
  "exitCode": 0
}
